{
  "dataset_version": "4.2",
  "snapshot_id": "normalize-v4.2-1-541360",
  "naics": "541360",
  "title": "Geophysical Surveying and Mapping Services",
  "labor_share": {
    "value": 0.7817,
    "quality": "MED",
    "basis": "QCEW 2024 private total annual wages at 541360 ($1,461,125,114) x benefits multiplier 1.4294 [ECEC private-industry total comp $46.60/hr / wages $32.60/hr = 1.4294 (March 2026 reference period)] / SUSB 2022 receipts at 541360 ($1,992,974,000). Vintage mismatch: 2024 wages over 2022 receipts, stated. Level: 6-digit. Harmonized to IPS basis ÷1.3407 (median of 65 dual-method codes)."
  },
  "n_total": {
    "value": 968,
    "quality": "HIGH",
    "basis": "SUSB 2022 (firms, all enterprise sizes)"
  },
  "n_band": {
    "value": 78,
    "quality": "LOW",
    "basis": "margin 0.1565 (margins.json[54]: Damodaran Jan 2026: Business & Consumer Services EBITDA/Sales 15.65%); revenue/employee $274,931 (SUSB 2022 receipts/employment at 541360); class <5: 726 firms, avg revenue/firm $284,807 (class receipts/firms), implied EBITDA $44,572 -> out of $1-10M band; class 5-9: 99 firms, avg revenue/firm $1,215,010 (class receipts/firms), implied EBITDA $190,149 -> out of $1-10M band; class 10-19: 65 firms, avg revenue/firm $2,396,492 (class receipts/firms), implied EBITDA $375,051 -> out of $1-10M band; class 20-99: 45 firms, avg revenue/firm $6,642,467 (class receipts/firms), implied EBITDA $1,039,546 -> IN $1-10M band; class 100-499: 17 firms, avg revenue/firm $39,378,118 (class receipts/firms), implied EBITDA $6,162,675 -> IN $1-10M band; class 500+: 16 firms, avg revenue/firm $33,862,938 (class receipts/firms), implied EBITDA $5,299,550 -> IN $1-10M band; n_band = 78"
  },
  "role_mix": {
    "basis": "4-digit 5413",
    "quality": "MED",
    "occupations": [
      {
        "soc": "17-2051",
        "title": "Civil Engineers",
        "employment_share": 0.1164,
        "wage_share": 0.128
      },
      {
        "soc": "17-1011",
        "title": "Architects, Except Landscape and Naval",
        "employment_share": 0.0564,
        "wage_share": 0.0582
      },
      {
        "soc": "13-1082",
        "title": "Project Management Specialists",
        "employment_share": 0.0551,
        "wage_share": 0.0646
      },
      {
        "soc": "17-3011",
        "title": "Architectural and Civil Drafters",
        "employment_share": 0.0474,
        "wage_share": 0.0328
      },
      {
        "soc": "11-1021",
        "title": "General and Operations Managers",
        "employment_share": 0.0338,
        "wage_share": 0.0572
      },
      {
        "soc": "17-2141",
        "title": "Mechanical Engineers",
        "employment_share": 0.0337,
        "wage_share": 0.0383
      },
      {
        "soc": "11-9041",
        "title": "Architectural and Engineering Managers",
        "employment_share": 0.0321,
        "wage_share": 0.0553
      },
      {
        "soc": "47-4011",
        "title": "Construction and Building Inspectors",
        "employment_share": 0.0256,
        "wage_share": 0.0205
      },
      {
        "soc": "17-2071",
        "title": "Electrical Engineers",
        "employment_share": 0.0254,
        "wage_share": 0.0299
      },
      {
        "soc": "15-1252",
        "title": "Software Developers",
        "employment_share": 0.023,
        "wage_share": 0.0308
      }
    ]
  },
  "provenance": {
    "derivation_version": "normalize-v4.2-1",
    "source_manifest_sha256": "6bd587a092cef70e3eb269bbc6668a327babd51e70c2fef16d0b668698d71831",
    "vintage": "2024 wages / 2022 receipts | 2022"
  }
}
