{
  "dataset_version": "4.2",
  "snapshot_id": "normalize-v4.2-1-541850",
  "naics": "541850",
  "title": "Indoor and Outdoor Display Advertising",
  "labor_share": {
    "value": 0.3265,
    "quality": "MED",
    "basis": "QCEW 2024 private total annual wages at 541850 ($2,510,459,678) x benefits multiplier 1.4294 [ECEC private-industry total comp $46.60/hr / wages $32.60/hr = 1.4294 (March 2026 reference period)] / SUSB 2022 receipts at 541850 ($8,196,645,000). Vintage mismatch: 2024 wages over 2022 receipts, stated. Level: 6-digit. Harmonized to IPS basis ÷1.3407 (median of 65 dual-method codes)."
  },
  "n_total": {
    "value": 2083,
    "quality": "HIGH",
    "basis": "SUSB 2022 (firms, all enterprise sizes)"
  },
  "n_band": {
    "value": 112,
    "quality": "LOW",
    "basis": "margin 0.1565 (margins.json[54]: Damodaran Jan 2026: Business & Consumer Services EBITDA/Sales 15.65%); revenue/employee $382,092 (SUSB 2022 receipts/employment at 541850); class <5: 1,543 firms, avg revenue/firm $457,235 (class receipts/firms), implied EBITDA $71,557 -> out of $1-10M band; class 5-9: 283 firms, avg revenue/firm $1,808,318 (class receipts/firms), implied EBITDA $283,002 -> out of $1-10M band; class 10-19: 130 firms, avg revenue/firm $3,468,000 (class receipts/firms), implied EBITDA $542,742 -> out of $1-10M band; class 20-99: 84 firms, avg revenue/firm $12,111,917 (class receipts/firms), implied EBITDA $1,895,515 -> IN $1-10M band; class 100-499: 28 firms, avg revenue/firm $53,150,286 (class receipts/firms), implied EBITDA $8,318,020 -> IN $1-10M band; class 500+: 15 firms, avg revenue/firm $268,195,267 (class receipts/firms), implied EBITDA $41,972,559 -> out of $1-10M band; n_band = 112"
  },
  "role_mix": {
    "basis": "4-digit 5418",
    "quality": "MED",
    "occupations": [
      {
        "soc": "41-3011",
        "title": "Advertising Sales Agents",
        "employment_share": 0.0952,
        "wage_share": 0.0818
      },
      {
        "soc": "27-3031",
        "title": "Public Relations Specialists",
        "employment_share": 0.0799,
        "wage_share": 0.0829
      },
      {
        "soc": "13-1161",
        "title": "Market Research Analysts and Marketing Specialists",
        "employment_share": 0.0741,
        "wage_share": 0.0655
      },
      {
        "soc": "11-1021",
        "title": "General and Operations Managers",
        "employment_share": 0.0539,
        "wage_share": 0.0926
      },
      {
        "soc": "27-1024",
        "title": "Graphic Designers",
        "employment_share": 0.0449,
        "wage_share": 0.033
      },
      {
        "soc": "41-9011",
        "title": "Demonstrators and Product Promoters",
        "employment_share": 0.0389,
        "wage_share": 0.0162
      },
      {
        "soc": "41-3091",
        "title": "Sales Representatives of Services, Except Advertising, Insurance, Financial Services, and Travel",
        "employment_share": 0.0353,
        "wage_share": 0.0302
      },
      {
        "soc": "27-1026",
        "title": "Merchandise Displayers and Window Trimmers",
        "employment_share": 0.029,
        "wage_share": 0.0121
      },
      {
        "soc": "11-2021",
        "title": "Marketing Managers",
        "employment_share": 0.0285,
        "wage_share": 0.052
      },
      {
        "soc": "27-1011",
        "title": "Art Directors",
        "employment_share": 0.0282,
        "wage_share": 0.0407
      }
    ]
  },
  "provenance": {
    "derivation_version": "normalize-v4.2-1",
    "source_manifest_sha256": "56c77dc48512acea49e763f0e861a69c33e23142bb32c5d5d228c43a8e3c624d",
    "vintage": "2024 wages / 2022 receipts | 2022"
  }
}
