{
  "dataset_version": "4.2",
  "snapshot_id": "normalize-v4.2-1-541420",
  "naics": "541420",
  "title": "Industrial Design Services",
  "labor_share": {
    "value": 0.9177,
    "quality": "MED",
    "basis": "QCEW 2024 private total annual wages at 541420 ($2,501,498,861) x benefits multiplier 1.4294 [ECEC private-industry total comp $46.60/hr / wages $32.60/hr = 1.4294 (March 2026 reference period)] / SUSB 2022 receipts at 541420 ($2,906,073,000). Vintage mismatch: 2024 wages over 2022 receipts, stated. Level: 6-digit. Harmonized to IPS basis ÷1.3407 (median of 65 dual-method codes)."
  },
  "n_total": {
    "value": 1610,
    "quality": "HIGH",
    "basis": "SUSB 2022 (firms, all enterprise sizes)"
  },
  "n_band": {
    "value": 131,
    "quality": "LOW",
    "basis": "margin 0.1565 (margins.json[54]: Damodaran Jan 2026: Business & Consumer Services EBITDA/Sales 15.65%); revenue/employee $233,495 (SUSB 2022 receipts/employment at 541420); class <5: 1,208 firms, avg revenue/firm $356,066 (class receipts/firms), implied EBITDA $55,724 -> out of $1-10M band; class 5-9: 177 firms, avg revenue/firm $1,730,514 (class receipts/firms), implied EBITDA $270,825 -> out of $1-10M band; class 10-19: 94 firms, avg revenue/firm $3,101,245 (class receipts/firms), implied EBITDA $485,345 -> out of $1-10M band; class 20-99: 85 firms, avg revenue/firm $10,402,424 (class receipts/firms), implied EBITDA $1,627,979 -> IN $1-10M band; class 100-499: 16 firms, avg revenue/firm $45,169,000 (class receipts/firms), implied EBITDA $7,068,948 -> IN $1-10M band; class 500+: 30 firms, avg revenue/firm $9,040,567 (class receipts/firms), implied EBITDA $1,414,849 -> IN $1-10M band; n_band = 131"
  },
  "role_mix": {
    "basis": "4-digit 5414",
    "quality": "MED",
    "occupations": [
      {
        "soc": "27-1025",
        "title": "Interior Designers",
        "employment_share": 0.1905,
        "wage_share": 0.1841
      },
      {
        "soc": "27-1024",
        "title": "Graphic Designers",
        "employment_share": 0.1622,
        "wage_share": 0.1538
      },
      {
        "soc": "11-1021",
        "title": "General and Operations Managers",
        "employment_share": 0.0696,
        "wage_share": 0.1238
      },
      {
        "soc": "41-3091",
        "title": "Sales Representatives of Services, Except Advertising, Insurance, Financial Services, and Travel",
        "employment_share": 0.0323,
        "wage_share": 0.0374
      },
      {
        "soc": "13-1082",
        "title": "Project Management Specialists",
        "employment_share": 0.0297,
        "wage_share": 0.0347
      },
      {
        "soc": "43-9061",
        "title": "Office Clerks, General",
        "employment_share": 0.0284,
        "wage_share": 0.0178
      },
      {
        "soc": "53-7062",
        "title": "Laborers and Freight, Stock, and Material Movers, Hand",
        "employment_share": 0.0201,
        "wage_share": 0.0122
      },
      {
        "soc": "13-1161",
        "title": "Market Research Analysts and Marketing Specialists",
        "employment_share": 0.0199,
        "wage_share": 0.0199
      },
      {
        "soc": "43-6014",
        "title": "Secretaries and Administrative Assistants, Except Legal, Medical, and Executive",
        "employment_share": 0.0194,
        "wage_share": 0.0128
      },
      {
        "soc": "27-1011",
        "title": "Art Directors",
        "employment_share": 0.019,
        "wage_share": 0.0296
      }
    ]
  },
  "provenance": {
    "derivation_version": "normalize-v4.2-1",
    "source_manifest_sha256": "8f5aa6e7f684193110fec4aa003012bd0ed2572dcf989d980ce01f5b5a3d4279",
    "vintage": "2024 wages / 2022 receipts | 2022"
  }
}
