{
  "dataset_version": "4.2",
  "snapshot_id": "normalize-v4.2-1-541310",
  "naics": "541310",
  "title": "Architectural Services",
  "labor_share": {
    "value": 0.4625,
    "quality": "HIGH",
    "basis": "BLS Industry Productivity (IPS) direct: labor compensation (L02) $25,388.4M / sectoral output (T30) $54,890.2M, year 2022"
  },
  "n_total": {
    "value": 21294,
    "quality": "HIGH",
    "basis": "SUSB 2022 (firms, all enterprise sizes)"
  },
  "n_band": {
    "value": 1589,
    "quality": "LOW",
    "basis": "margin 0.1565 (margins.json[54]: Damodaran Jan 2026: Business & Consumer Services EBITDA/Sales 15.65%); revenue/employee $263,174 (SUSB 2022 receipts/employment at 541310); class <5: 13,996 firms, avg revenue/firm $377,518 (class receipts/firms), implied EBITDA $59,082 -> out of $1-10M band; class 5-9: 3,719 firms, avg revenue/firm $1,387,500 (class receipts/firms), implied EBITDA $217,144 -> out of $1-10M band; class 10-19: 1,928 firms, avg revenue/firm $3,115,513 (class receipts/firms), implied EBITDA $487,578 -> out of $1-10M band; class 20-99: 1,361 firms, avg revenue/firm $10,632,600 (class receipts/firms), implied EBITDA $1,664,002 -> IN $1-10M band; class 100-499: 228 firms, avg revenue/firm $44,196,899 (class receipts/firms), implied EBITDA $6,916,815 -> IN $1-10M band; class 500+: 62 firms, avg revenue/firm $111,625,710 (class receipts/firms), implied EBITDA $17,469,424 -> out of $1-10M band; n_band = 1,589"
  },
  "role_mix": {
    "basis": "4-digit 5413",
    "quality": "MED",
    "occupations": [
      {
        "soc": "17-2051",
        "title": "Civil Engineers",
        "employment_share": 0.1164,
        "wage_share": 0.128
      },
      {
        "soc": "17-1011",
        "title": "Architects, Except Landscape and Naval",
        "employment_share": 0.0564,
        "wage_share": 0.0582
      },
      {
        "soc": "13-1082",
        "title": "Project Management Specialists",
        "employment_share": 0.0551,
        "wage_share": 0.0646
      },
      {
        "soc": "17-3011",
        "title": "Architectural and Civil Drafters",
        "employment_share": 0.0474,
        "wage_share": 0.0328
      },
      {
        "soc": "11-1021",
        "title": "General and Operations Managers",
        "employment_share": 0.0338,
        "wage_share": 0.0572
      },
      {
        "soc": "17-2141",
        "title": "Mechanical Engineers",
        "employment_share": 0.0337,
        "wage_share": 0.0383
      },
      {
        "soc": "11-9041",
        "title": "Architectural and Engineering Managers",
        "employment_share": 0.0321,
        "wage_share": 0.0553
      },
      {
        "soc": "47-4011",
        "title": "Construction and Building Inspectors",
        "employment_share": 0.0256,
        "wage_share": 0.0205
      },
      {
        "soc": "17-2071",
        "title": "Electrical Engineers",
        "employment_share": 0.0254,
        "wage_share": 0.0299
      },
      {
        "soc": "15-1252",
        "title": "Software Developers",
        "employment_share": 0.023,
        "wage_share": 0.0308
      }
    ]
  },
  "provenance": {
    "derivation_version": "normalize-v4.2-1",
    "source_manifest_sha256": "82f7edcd570a7116136f50bb49c8827d39cd38c4a0a6a301972056fd18c241d7",
    "vintage": "2022"
  }
}
