{
  "dataset_version": "4.2",
  "snapshot_id": "normalize-v4.2-1-541810",
  "naics": "541810",
  "title": "Advertising Agencies",
  "labor_share": {
    "value": 0.4814,
    "quality": "HIGH",
    "basis": "BLS Industry Productivity (IPS) direct: labor compensation (L02) $33,005.0M / sectoral output (T30) $68,557.8M, year 2022"
  },
  "n_total": {
    "value": 13682,
    "quality": "HIGH",
    "basis": "SUSB 2022 (firms, all enterprise sizes)"
  },
  "n_band": {
    "value": 1175,
    "quality": "LOW",
    "basis": "margin 0.1565 (margins.json[54]: Damodaran Jan 2026: Business & Consumer Services EBITDA/Sales 15.65%); revenue/employee $303,923 (SUSB 2022 receipts/employment at 541810); class <5: 9,620 firms, avg revenue/firm $521,704 (class receipts/firms), implied EBITDA $81,647 -> out of $1-10M band; class 5-9: 1,690 firms, avg revenue/firm $1,849,936 (class receipts/firms), implied EBITDA $289,515 -> out of $1-10M band; class 10-19: 1,101 firms, avg revenue/firm $3,849,742 (class receipts/firms), implied EBITDA $602,485 -> out of $1-10M band; class 20-99: 977 firms, avg revenue/firm $12,049,911 (class receipts/firms), implied EBITDA $1,885,811 -> IN $1-10M band; class 100-499: 198 firms, avg revenue/firm $48,263,556 (class receipts/firms), implied EBITDA $7,553,246 -> IN $1-10M band; class 500+: 96 firms, avg revenue/firm $267,062,250 (class receipts/firms), implied EBITDA $41,795,242 -> out of $1-10M band; n_band = 1,175"
  },
  "role_mix": {
    "basis": "4-digit 5418",
    "quality": "MED",
    "occupations": [
      {
        "soc": "41-3011",
        "title": "Advertising Sales Agents",
        "employment_share": 0.0952,
        "wage_share": 0.0818
      },
      {
        "soc": "27-3031",
        "title": "Public Relations Specialists",
        "employment_share": 0.0799,
        "wage_share": 0.0829
      },
      {
        "soc": "13-1161",
        "title": "Market Research Analysts and Marketing Specialists",
        "employment_share": 0.0741,
        "wage_share": 0.0655
      },
      {
        "soc": "11-1021",
        "title": "General and Operations Managers",
        "employment_share": 0.0539,
        "wage_share": 0.0926
      },
      {
        "soc": "27-1024",
        "title": "Graphic Designers",
        "employment_share": 0.0449,
        "wage_share": 0.033
      },
      {
        "soc": "41-9011",
        "title": "Demonstrators and Product Promoters",
        "employment_share": 0.0389,
        "wage_share": 0.0162
      },
      {
        "soc": "41-3091",
        "title": "Sales Representatives of Services, Except Advertising, Insurance, Financial Services, and Travel",
        "employment_share": 0.0353,
        "wage_share": 0.0302
      },
      {
        "soc": "27-1026",
        "title": "Merchandise Displayers and Window Trimmers",
        "employment_share": 0.029,
        "wage_share": 0.0121
      },
      {
        "soc": "11-2021",
        "title": "Marketing Managers",
        "employment_share": 0.0285,
        "wage_share": 0.052
      },
      {
        "soc": "27-1011",
        "title": "Art Directors",
        "employment_share": 0.0282,
        "wage_share": 0.0407
      }
    ]
  },
  "provenance": {
    "derivation_version": "normalize-v4.2-1",
    "source_manifest_sha256": "ca135ae6cc9d118ff38cc389e59dbf320718a998972137e6296b63f5c75298a4",
    "vintage": "2022"
  }
}
